verse,text,category
"Mark 1,29-31","The beginning of the Good News of Jesus Christ, the Son of God.
As it is written in the prophets,
“Behold, I send my messenger before your face,
who will prepare your way before you:
the voice of one crying in the wilderness,
‘Make ready the way of the Lord!
Make his paths straight!’”
John came baptizing in the wilderness and preaching the baptism of repentance for forgiveness of sins.
All the country of Judea and all those of Jerusalem went out to him. They were baptized by him in the Jordan river, confessing their sins.
John was clothed with camel’s hair and a leather belt around his waist. He ate locusts and wild honey.
He preached, saying, “After me comes he who is mightier than I, the thong of whose sandals I am not worthy to stoop down and loosen.
I baptized you in water, but he will baptize you in the Holy Spirit.”
In those days, Jesus came from Nazareth of Galilee, and was baptized by John in the Jordan.
Immediately coming up from the water, he saw the heavens parting, and the Spirit descending on him like a dove.
A voice came out of the sky, “You are my beloved Son, in whom I am well pleased.”
Immediately the Spirit drove him out into the wilderness.
He was there in the wilderness forty days tempted by Satan. He was with the wild animals; and the angels were serving him.
Now after John was taken into custody, Jesus came into Galilee, preaching the Good News of God’s Kingdom,
and saying,
“The time is fulfilled, and God’s Kingdom is at hand! Repent, and believe in the Good News.”
Passing along by the sea of Galilee, he saw Simon and Andrew the brother of Simon casting a net into the sea, for they were fishermen.
Jesus said to them,
“Come after me, and I will make you into fishers for men.”
Immediately they left their nets, and followed him.
Going on a little further from there, he saw James the son of Zebedee, and John, his brother, who were also in the boat mending the nets.
Immediately he called them, and they left their father, Zebedee, in the boat with the hired servants, and went after him.
They went into Capernaum, and immediately on the Sabbath day he entered into the synagogue and taught.
They were astonished at his teaching, for he taught them as having authority, and not as the scribes.
Immediately there was in their synagogue a man with an unclean spirit, and he cried out,
saying, “Ha! What do we have to do with you, Jesus, you Nazarene? Have you come to destroy us? I know you who you are: the Holy One of God!”
Jesus rebuked him, saying,
“Be quiet, and come out of him!”

The unclean spirit, convulsing him and crying with a loud voice, came out of him.
They were all amazed, so that they questioned among themselves, saying, “What is this? A new teaching? For with authority he commands even the unclean spirits, and they obey him!”
The report of him went out immediately everywhere into all the region of Galilee and its surrounding area.
Immediately, when they had come out of the synagogue, they came into the house of Simon and Andrew, with James and John.
Now Simon’s wife’s mother lay sick with a fever, and immediately they told him about her.
He came and took her by the hand, and raised her up. The fever left her, and she served them.
At evening, when the sun had set, they brought to him all who were sick, and those who were possessed by demons.
All the city was gathered together at the door.
He healed many who were sick with various diseases, and cast out many demons. He didn’t allow the demons to speak, because they knew him.
Early in the morning, while it was still dark, he rose up and went out, and departed into a deserted place, and prayed there.
Simon and those who were with him followed after him;
and they found him, and told him, “Everyone is looking for you.”
He said to them,
“Let’s go elsewhere into the next towns, that I may preach there also, because I came out for this reason.”
He went into their synagogues throughout all Galilee, preaching and casting out demons.
A leper came to him, begging him, kneeling down to him, and saying to him, “If you want to, you can make me clean.”
Being moved with compassion, he stretched out his hand, and touched him, and said to him,
“I want to. Be made clean.”
When he had said this, immediately the leprosy departed from him, and he was made clean.
He strictly warned him, and immediately sent him out,
and said to him,
“See you say nothing to anybody, but go show yourself to the priest, and offer for your cleansing the things which Moses commanded, for a testimony to them.”
But he went out, and began to proclaim it much, and to spread about the matter, so that Jesus could no more openly enter into a city, but was outside in desert places: and they came to him from everywhere.
Immediately, when they had come out of the synagogue, they came into the house of Simon and Andrew, with James and John.
Now Simon’s wife’s mother lay sick with a fever, and immediately they told him about her.
He came and took her by the hand, and raised her up. The fever left her, and she served them.
",2
Mark 4:1-9,"Again he began to teach by the seaside. A great multitude was gathered to him, so that he entered into a boat in the sea, and sat down. All the multitude were on the land by the sea.
He taught them many things in parables, and told them in his teaching,

“Listen! Behold, the farmer went out to sow,


and as he sowed, some seed fell by the road, and the birds
came and devoured it.


Others fell on the rocky ground, where it had little soil, and immediately it sprang up, because it had no depth of soil.


When the sun had risen, it was scorched; and because it had no root, it withered away.


Others fell among the thorns, and the thorns grew up, and choked it, and it yielded no fruit.


Others fell into the good ground, and yielded fruit, growing up and increasing. Some produced thirty times, some sixty times, and some one hundred times as much.”
He said,
“Whoever has ears to hear, let him hear.”
",1
Mark 4:35-41,"On that day, when evening had come, he said to them,
“Let’s go over to the other side.”
Leaving the multitude, they took him with them, even as he was, in the boat. Other small boats were also with him.
A big wind storm arose, and the waves beat into the boat, so much that the boat was already filled.
He himself was in the stern, asleep on the cushion, and they woke him up, and told him, “Teacher, don’t you care that we are dying?”
He awoke, and rebuked the wind, and said to the sea,
“Peace! Be still!” The wind ceased, and there was a great calm.
He said to them,
“Why are you so afraid? How is it that you have no faith?”
They were greatly afraid, and said to one another, “Who then is this, that even the wind and the sea obey him?”
",2
Mark 5:21-43,"When Jesus had crossed back over in the boat to the other side, a great multitude was gathered to him; and he was by the sea.
Behold, one of the rulers of the synagogue, Jairus by name, came; and seeing him, he fell at his feet,
and begged him much, saying, “My little daughter is at the point of death. Please come and lay your hands on her, that she may be made healthy, and live.”
He went with him, and a great multitude followed him, and they pressed upon him on all sides.
A certain woman, who had an issue of blood for twelve years,
and had suffered many things by many physicians, and had spent all that she had, and was no better, but rather grew worse,
having heard the things concerning Jesus, came up behind him in the crowd, and touched his clothes.
For she said, “If I just touch his clothes, I will be made well.”
Immediately the flow of her blood was dried up, and she felt in her body that she was healed of her affliction.
Immediately Jesus, perceiving in himself that the power had gone out from him, turned around in the crowd, and asked,
“Who touched my clothes?”
His disciples said to him, “You see the multitude pressing against you, and you say, ‘Who touched me?’”
He looked around to see her who had done this thing.
But the woman, fearing and trembling, knowing what had been done to her, came and fell down before him, and told him all the truth.
He said to her,
“Daughter, your faith has made you well. Go in peace, and be cured of your disease.”
While he was still speaking, people came from the synagogue ruler’s house saying, “Your daughter is dead. Why bother the Teacher any more?”
But Jesus, when he heard the message spoken, immediately said to the ruler of the synagogue,
“Don’t be afraid, only believe.”
He allowed no one to follow him, except Peter, James, and John the brother of James.
He came to the synagogue ruler’s house, and he saw an uproar, weeping, and great wailing.
When he had entered in, he said to them,
“Why do you make an uproar and weep? The child is not dead, but is asleep.”
They ridiculed him. But he, having put them all out, took the father of the child, her mother, and those who were with him, and went in where the child was lying.
Taking the child by the hand, he said to her,
“Talitha cumi!”
 which means, being interpreted,
“Girl, I tell you, get up!”

Immediately the girl rose up and walked, for she was twelve years old. They were amazed with great amazement.
He strictly ordered them that no one should know this, and commanded that something should be given to her to eat.
",2
Mark 6:30-44,"The apostles gathered themselves together to Jesus, and they told him all things, whatever they had done, and whatever they had taught.
He said to them,
“You come apart into a deserted place, and rest awhile.” For there were many coming and going, and they had no leisure so much as to eat.
They went away in the boat to a deserted place by themselves.
They saw them going, and many recognized him and ran there on foot from all the cities. They arrived before them and came together to him.
Jesus came out, saw a great multitude, and he had compassion on them, because they were like sheep without a shepherd, and he began to teach them many things.
When it was late in the day, his disciples came to him, and said, “This place is deserted, and it is late in the day.
Send them away, that they may go into the surrounding country and villages, and buy themselves bread, for they have nothing to eat.”
But he answered them,
“You give them something to eat.”
They asked him, “Shall we go and buy two hundred denarii worth of bread, and give them something to eat?”
He said to them,
“How many loaves do you have? Go see.”
When they knew, they said, “Five, and two fish.”
He commanded them that everyone should sit down in groups on the green grass.
They sat down in ranks, by hundreds and by fifties.
He took the five loaves and the two fish, and looking up to heaven, he blessed and broke the loaves, and he gave to his disciples to set before them, and he divided the two fish among them all.
They all ate, and were filled.
They took up twelve baskets full of broken pieces and also of the fish.
Those who ate the loaves were five thousand men.
",2
Mark 9:2-8,"After six days Jesus took with him Peter, James, and John, and brought them up onto a high mountain privately by themselves, and he was changed into another form in front of them.
His clothing became glistening, exceedingly white, like snow, such as no launderer on earth can whiten them.
Elijah and Moses appeared to them, and they were talking with Jesus.
Peter answered Jesus, “Rabbi, it is good for us to be here. Let’s make three tents: one for you, one for Moses, and one for Elijah.”
For he didn’t know what to say, for they were very afraid.
A cloud came, overshadowing them, and a voice came out of the cloud, “This is my beloved Son. Listen to him.”
Suddenly looking around, they saw no one with them any more, except Jesus only.
",0
Mark 9:33-37,"He came to Capernaum, and when he was in the house he asked them,
“What were you arguing among yourselves on the way?”
But they were silent, for they had disputed one with another on the way about who was the greatest.
He sat down, and called the twelve; and he said to them,
“If any man wants to be first, he shall be last of all, and servant of all.”
He took a little child, and set him in the middle of them. Taking him in his arms, he said to them,

“Whoever receives one such little child in my name, receives me, and whoever receives me, doesn’t receive me, but him who sent me.”
",3
Mark 16:1-8,"When the Sabbath was past, Mary Magdalene, and Mary the mother of James, and Salome, bought spices, that they might come and anoint him.
Very early on the first day of the week, they came to the tomb when the sun had risen.
They were saying among themselves, “Who will roll away the stone from the door of the tomb for us?”
for it was very big. Looking up, they saw that the stone was rolled back.
Entering into the tomb, they saw a young man sitting on the right side, dressed in a white robe, and they were amazed.
He said to them, “Don’t be amazed. You seek Jesus, the Nazarene, who has been crucified. He has risen. He is not here. Behold, the place where they laid him!
But go, tell his disciples and Peter, ‘He goes before you into Galilee. There you will see him, as he said to you.’”
They went out, and fled from the tomb, for trembling and astonishment had come on them. They said nothing to anyone; for they were afraid.
",0
Luke 2:1-20,"Now in those days, a decree went out from Caesar Augustus that all the world should be enrolled.
This was the first enrollment made when Quirinius was governor of Syria.
All went to enroll themselves, everyone to his own city.
Joseph also went up from Galilee, out of the city of Nazareth, into Judea, to David’s city, which is called Bethlehem, because he was of the house and family of David;
to enroll himself with Mary, who was pledged to be married to him as wife, being pregnant.
While they were there, the day had come for her to give birth.
She gave birth to her firstborn son. She wrapped him in bands of cloth, and laid him in a feeding trough, because there was no room for them in the inn.
There were shepherds in the same country staying in the field, and keeping watch by night over their flock.
Behold, an angel of the Lord stood by them, and the glory of the Lord shone around them, and they were terrified.
The angel said to them, “Don’t be afraid, for behold, I bring you good news of great joy which will be to all the people.
For there is born to you today, in David’s city, a Savior, who is Christ the Lord.
This is the sign to you: you will find a baby wrapped in strips of cloth, lying in a feeding trough.”
Suddenly, there was with the angel a multitude of the heavenly army praising God, and saying,
“Glory to God in the highest,
on earth peace, good will toward men.”
When the angels went away from them into the sky, the shepherds said to one another, “Let’s go to Bethlehem, now, and see this thing that has happened, which the Lord has made known to us.”
They came with haste, and found both Mary and Joseph, and the baby was lying in the feeding trough.
When they saw it, they publicized widely the saying which was spoken to them about this child.
All who heard it wondered at the things which were spoken to them by the shepherds.
But Mary kept all these sayings, pondering them in her heart.
The shepherds returned, glorifying and praising God for all the things that they had heard and seen, just as it was told them.
",0
Luke 3:21-22,"Now when all the people were baptized, Jesus also had been baptized, and was praying. The sky was opened,
and the Holy Spirit descended in a bodily form like a dove on him; and a voice came out of the sky, saying “You are my beloved Son. In you I am well pleased.”
",0
Luke 4:1-13,"Jesus, full of the Holy Spirit, returned from the Jordan, and was led by the Spirit into the wilderness
for forty days, being tempted by the devil. He ate nothing in those days. Afterward, when they were completed, he was hungry.
The devil said to him, “If you are the Son of God, command this stone to become bread.”
Jesus answered him, saying,
“It is written, ‘Man shall not live by bread alone, but by every word of God.’”
The devil, leading him up on a high mountain, showed him all the kingdoms of the world in a moment of time.
The devil said to him, “I will give you all this authority, and their glory, for it has been delivered to me; and I give it to whomever I want.
If you therefore will worship before me, it will all be yours.”
Jesus answered him,
“Get behind me Satan! For it is written, ‘You shall worship the Lord your God, and you shall serve him only.’”
He led him to Jerusalem, and set him on the pinnacle of the temple, and said to him, “If you are the Son of God, cast yourself down from here,
for it is written,
‘He will put his angels in charge of you, to guard you;’
and,
‘On their hands they will bear you up,
lest perhaps you dash your foot against a stone.’”
Jesus answering, said to him,
“It has been said, ‘You shall not tempt the Lord your God.’”
When the devil had completed every temptation, he departed from him until another time.
",0
Luke 4:38-41,"He rose up from the synagogue, and entered into Simon’s house. Simon’s mother-in-law was afflicted with a great fever, and they begged him for her.
He stood over her, and rebuked the fever; and it left her. Immediately she rose up and served them.
When the sun was setting, all those who had any sick with various diseases brought them to him; and he laid his hands on every one of them, and healed them.
Demons also came out of many, crying out, and saying, “You are the Christ, the Son of God!” Rebuking them, he didn’t allow them to speak, because they knew that he was the Christ.
",2
Luke 5:1-11,"Now while the multitude pressed on him and heard the word of God, he was standing by the lake of Gennesaret.
He saw two boats standing by the lake, but the fishermen had gone out of them, and were washing their nets.
He entered into one of the boats, which was Simon’s, and asked him to put out a little from the land. He sat down and taught the multitudes from the boat.
When he had finished speaking, he said to Simon,
“Put out into the deep, and let down your nets for a catch.”
Simon answered him, “Master, we worked all night, and took nothing; but at your word I will let down the net.”
When they had done this, they caught a great multitude of fish, and their net was breaking.
They beckoned to their partners in the other boat, that they should come and help them. They came, and filled both boats, so that they began to sink.
But Simon Peter, when he saw it, fell down at Jesus’ knees, saying, “Depart from me, for I am a sinful man, Lord.”
For he was amazed, and all who were with him, at the catch of fish which they had caught;
and so also were James and John, sons of Zebedee, who were partners with Simon.
Jesus said to Simon,
“Don’t be afraid. From now on you will be catching people alive.”
When they had brought their boats to land, they left everything, and followed him.
",0
Luke 6:27-36,"
“But I tell you who hear: love your enemies, do good to those who hate you,


bless those who curse you, and pray for those who mistreat you.


To him who strikes you on the cheek, offer also the other; and from him who takes away your cloak, don’t withhold your coat also.


Give to everyone who asks you, and don’t ask him who takes away your goods to give them back again.

“As you would like people to do to you, do exactly so to them.


If you love those who love you, what credit is that to you? For even sinners love those who love them.


If you do good to those who do good to you, what credit is that to you? For even sinners do the same.


If you lend to those from whom you hope to receive, what credit is that to you? Even sinners lend to sinners, to receive back as much.


But love your enemies, and do good, and lend, expecting nothing back; and your reward will be great, and you will be children of the Most High; for he is kind toward the unthankful and evil.

“Therefore be merciful,
even as your Father is also merciful.
",3
Luke 8:4-15,"When a great multitude came together, and people from every city were coming to him, he spoke by a parable.

“The farmer went out to sow his seed. As he sowed, some fell along the road, and it was trampled under foot, and the birds of the sky devoured it.


Other seed fell on the rock, and as soon as it grew, it withered away, because it had no moisture.


Other fell amid the thorns, and the thorns grew with it, and choked it.


Other fell into the good ground, and grew, and produced one hundred times as much fruit.” As he said these things, he called out,
“He who has ears to hear, let him hear!”
Then his disciples asked him, “What does this parable mean?”
He said,
“To you it is given to know the mysteries of God’s Kingdom, but to the rest in parables; that ‘seeing they may not see, and hearing they may not understand.’

Now the parable is this: The seed is the word of God.


Those along the road are those who hear, then the devil comes, and takes away the word from their heart, that they may not believe and be saved.


Those on the rock are they who, when they hear, receive the word with joy; but these have no root, who believe for a while, then fall away in time of temptation.


That which fell among the thorns, these are those who have heard, and as they go on their way they are choked with cares, riches, and pleasures of life, and bring no fruit to maturity.


Those in the good ground, these are those who with an honest and good heart, having heard the word, hold it tightly, and produce fruit with perseverance.
",1
Luke 8:22-25,"Now on one of those days, he entered into a boat, himself and his disciples, and he said to them,
“Let’s go over to the other side of the lake.” So they launched out.
But as they sailed, he fell asleep. A wind storm came down on the lake, and they were taking on dangerous amounts of water.
They came to him, and awoke him, saying, “Master, master, we are dying!” He awoke, and rebuked the wind and the raging of the water, and they ceased, and it was calm.
He said to them,
“Where is your faith?” Being afraid they marveled, saying to one another, “Who is this then, that he commands even the winds and the water, and they obey him?”
",2
Luke 8:40-56,"When Jesus returned, the multitude welcomed him, for they were all waiting for him.
Behold, there came a man named Jairus, and he was a ruler of the synagogue. He fell down at Jesus’ feet, and begged him to come into his house,
for he had an only daughter, about twelve years of age, and she was dying. But as he went, the multitudes pressed against him.
A woman who had a flow of blood for twelve years, who had spent all her living on physicians, and could not be healed by any,
came behind him, and touched the fringe of his cloak, and immediately the flow of her blood stopped.
Jesus said,
“Who touched me?”
When all denied it, Peter and those with him said, “Master, the multitudes press and jostle you, and you say,
‘Who touched me?’”
But Jesus said,
“Someone did touch me, for I perceived that power has gone out of me.”
When the woman saw that she was not hidden, she came trembling, and falling down before him declared to him in the presence of all the people the reason why she had touched him, and how she was healed immediately.
He said to her,
“Daughter, cheer up. Your faith has made you well. Go in peace.”
While he still spoke, one from the ruler of the synagogue’s house came, saying to him, “Your daughter is dead. Don’t trouble the Teacher.”
But Jesus hearing it, answered him,
“Don’t be afraid. Only believe, and she will be healed.”
When he came to the house, he didn’t allow anyone to enter in, except Peter, John, James, the father of the child, and her mother.
All were weeping and mourning her, but he said,
“Don’t weep. She isn’t dead, but sleeping.”
They were ridiculing him, knowing that she was dead.
But he put them all outside, and taking her by the hand, he called, saying,
“Child, arise!”
Her spirit returned, and she rose up immediately. He commanded that something be given to her to eat.
Her parents were amazed, but he commanded them to tell no one what had been done.
",2
Luke 9:10-17,"The apostles, when they had returned, told him what things they had done.
He took them, and withdrew apart to a desert region of a city called Bethsaida.
But the multitudes, perceiving it, followed him. He welcomed them, and spoke to them of God’s Kingdom, and he cured those who needed healing.
The day began to wear away; and the twelve came, and said to him, “Send the multitude away, that they may go into the surrounding villages and farms, and lodge, and get food, for we are here in a deserted place.”
But he said to them,
“You give them something to eat.”
They said, “We have no more than five loaves and two fish, unless we should go and buy food for all these people.”
For they were about five thousand men.
He said to his disciples,
“Make them sit down in groups of about fifty each.”
They did so, and made them all sit down.
He took the five loaves and the two fish, and looking up to the sky, he blessed them, and broke them, and gave them to the disciples to set before the multitude.
They ate, and were all filled. They gathered up twelve baskets of broken pieces that were left over.
",2
