verse,text,category
Luke 9:28-36,"About eight days after these sayings, he took with him Peter, John, and James, and went up onto the mountain to pray.
As he was praying, the appearance of his face was altered, and his clothing became white and dazzling.
Behold, two men were talking with him, who were Moses and Elijah,
who appeared in glory, and spoke of his departure, which he was about to accomplish at Jerusalem.
Now Peter and those who were with him were heavy with sleep, but when they were fully awake, they saw his glory, and the two men who stood with him.
As they were parting from him, Peter said to Jesus, “Master, it is good for us to be here. Let’s make three tents: one for you, and one for Moses, and one for Elijah,” not knowing what he said.
While he said these things, a cloud came and overshadowed them, and they were afraid as they entered into the cloud.
A voice came out of the cloud, saying, “This is my beloved Son. Listen to him!”
When the voice came, Jesus was found alone. They were silent, and told no one in those days any of the things which they had seen.
",0
Luke 9:46-48,"There arose an argument among them about which of them was the greatest.
Jesus, perceiving the reasoning of their hearts, took a little child, and set him by his side,
and said to them,
“Whoever receives this little child in my name receives me. Whoever receives me receives him who sent me. For whoever is least among you all, this one will be great.”
",3
Luke 10:25-37,"Behold, a certain lawyer stood up and tested him, saying, “Teacher, what shall I do to inherit eternal life?”
He said to him,
“What is written in the law? How do you read it?”

He answered, “You shall love the Lord your God with all your heart, with all your soul, with all your strength, and with all your mind; and your neighbor as yourself.”
He said to him,
“You have answered correctly. Do this, and you will live.”
But he, desiring to justify himself, asked Jesus, “Who is my neighbor?”
Jesus answered,
“A certain man was going down from Jerusalem to Jericho, and he fell among robbers, who both stripped him and beat him, and departed, leaving him half dead.


By chance a certain priest was going down that way. When he saw him, he passed by on the other side.


In the same way a Levite also, when he came to the place, and saw him, passed by on the other side.


But a certain Samaritan, as he traveled, came where he was. When he saw him, he was moved with compassion,


came to him, and bound up his wounds, pouring on oil and wine. He set him on his own animal, and brought him to an inn, and took care of him.


On the next day, when he departed, he took out two denarii, and gave them to the host, and said to him, ‘Take care of him. Whatever you spend beyond that, I will repay you when I return.’


Now which of these three do you think seemed to be a neighbor to him who fell among the robbers?”
He said, “He who showed mercy on him.”
Then Jesus said to him,
“Go and do likewise.”
",1
Luke 22:14-20,"When the hour had come, he sat down with the twelve apostles.
He said to them,
“I have earnestly desired to eat this Passover with you before I suffer,


for I tell you, I will no longer by any means eat of it until it is fulfilled in God’s Kingdom.”
He received a cup, and when he had given thanks, he said,
“Take this, and share it among yourselves,


for I tell you, I will not drink at all again from the fruit of the vine, until God’s Kingdom comes.”
He took bread, and when he had given thanks, he broke, and gave it to them, saying,
“This is my body which is given for you. Do this in memory of me.”
Likewise, he took the cup after supper, saying,
“This cup is the new covenant in my blood, which is poured out for you.

",0
Luke 23:44-49,"It was now about the sixth hour, and darkness came over the whole land until the ninth hour.
The sun was darkened, and the veil of the temple was torn in two.
Jesus, crying with a loud voice, said,
“Father, into your hands I commit my spirit!” Having said this, he breathed his last.
When the centurion saw what was done, he glorified God, saying, “Certainly this was a righteous man.”
All the multitudes that came together to see this, when they saw the things that were done, returned home beating their breasts.
All his acquaintances, and the women who followed with him from Galilee, stood at a distance, watching these things.
",0
Luke 24:1-12,"But on the first day of the week, at early dawn, they and some others came to the tomb, bringing the spices which they had prepared.
They found the stone rolled away from the tomb.
They entered in, and didn’t find the Lord Jesus’ body.
While they were greatly perplexed about this, behold, two men stood by them in dazzling clothing.
Becoming terrified, they bowed their faces down to the earth.
They said to them, “Why do you seek the living among the dead?
He isn’t here, but is risen. Remember what he told you when he was still in Galilee,
saying that the Son of Man must be delivered up into the hands of sinful men, and be crucified, and the third day rise again?”
They remembered his words,
returned from the tomb, and told all these things to the eleven, and to all the rest.
Now they were Mary Magdalene, Joanna, and Mary the mother of James. The other women with them told these things to the apostles.
These words seemed to them to be nonsense, and they didn’t believe them.
But Peter got up and ran to the tomb. Stooping and looking in, he saw the strips of linen lying by themselves, and he departed to his home, wondering what had happened.
",0
John 1:1-18,"In the beginning was the Word, and the Word was with God, and the Word was God.
The same was in the beginning with God.
All things were made through him. Without him was not anything made that has been made.
In him was life, and the life was the light of men.
The light shines in the darkness, and the darkness hasn’t overcome
 it.
There came a man, sent from God, whose name was John.
The same came as a witness, that he might testify about the light, that all might believe through him.
He was not the light, but was sent that he might testify about the light.
The true light that enlightens everyone was coming into the world.
He was in the world, and the world was made through him, and the world didn’t recognize him.
He came to his own, and those who were his own didn’t receive him.
But as many as received him, to them he gave the right to become God’s children, to those who believe in his name:
who were born not of blood, nor of the will of the flesh, nor of the will of man, but of God.
The Word became flesh, and lived among us. We saw his glory, such glory as of the one and only Son of the Father, full of grace and truth.
John testified about him. He cried out, saying, “This was he of whom I said, ‘He who comes after me has surpassed me, for he was before me.’”
From his fullness we all received grace upon grace.
For the law was given through Moses. Grace and truth were realized through Jesus Christ.
No one has seen God at any time. The one and only Son, who is in the bosom of the Father, he has declared him.
",0
John 1:29-34,"The next day, he saw Jesus coming to him, and said, “Behold, the Lamb of God, who takes away the sin of the world!
This is he of whom I said, ‘After me comes a man who is preferred before me, for he was before me.’
I didn’t know him, but for this reason I came baptizing in water: that he would be revealed to Israel.”
John testified, saying, “I have seen the Spirit descending like a dove out of heaven, and it remained on him.
I didn’t recognize him, but he who sent me to baptize in water, he said to me, ‘On whomever you will see the Spirit descending, and remaining on him, the same is he who baptizes in the Holy Spirit.’
I have seen, and have testified that this is the Son of God.”
",0
John 2:1-11,"The third day, there was a marriage in Cana of Galilee. Jesus’ mother was there.
Jesus also was invited, with his disciples, to the marriage.
When the wine ran out, Jesus’ mother said to him, “They have no wine.”
Jesus said to her,
“Woman, what does that have to do with you and me? My hour has not yet come.”
His mother said to the servants, “Whatever he says to you, do it.”
Now there were six water pots of stone set there after the Jews’ way of purifying, containing two or three metretes apiece.
Jesus said to them,
“Fill the water pots with water.” They filled them up to the brim.
He said to them,
“Now draw some out, and take it to the ruler of the feast.” So they took it.
When the ruler of the feast tasted the water now become wine, and didn’t know where it came from (but the servants who had drawn the water knew), the ruler of the feast called the bridegroom,
and said to him, “Everyone serves the good wine first, and when the guests have drunk freely, then that which is worse. You have kept the good wine until now!”
This beginning of his signs Jesus did in Cana of Galilee, and revealed his glory; and his disciples believed in him.
",2
John 3:1-21,"Now there was a man of the Pharisees named Nicodemus, a ruler of the Jews.
The same came to him by night, and said to him, “Rabbi, we know that you are a teacher come from God, for no one can do these signs that you do, unless God is with him.”
Jesus answered him,
“Most certainly, I tell you, unless one is born anew,

he can’t see God’s Kingdom.”
Nicodemus said to him, “How can a man be born when he is old? Can he enter a second time into his mother’s womb, and be born?”
Jesus answered,
“Most certainly I tell you, unless one is born of water and spirit, he can’t enter into God’s Kingdom.

That which is born of the flesh is flesh. That which is born of the Spirit is spirit.


Don’t marvel that I said to you, ‘You must be born anew.’


The wind
blows where it wants to, and you hear its sound, but don’t know where it comes from and where it is going. So is everyone who is born of the Spirit.”
Nicodemus answered him, “How can these things be?”
Jesus answered him,
“Are you the teacher of Israel, and don’t understand these things?


Most certainly I tell you, we speak that which we know, and testify of that which we have seen, and you don’t receive our witness.


If I told you earthly things and you don’t believe, how will you believe if I tell you heavenly things?


No one has ascended into heaven, but he who descended out of heaven, the Son of Man, who is in heaven.


As Moses lifted up the serpent in the wilderness, even so must the Son of Man be lifted up,


that whoever believes in him should not perish, but have eternal life.


For God so loved the world, that he gave his one and only Son, that whoever believes in him should not perish, but have eternal life.


For God didn’t send his Son into the world to judge the world, but that the world should be saved through him.


He who believes in him is not judged. He who doesn’t believe has been judged already, because he has not believed in the name of the one and only Son of God.


This is the judgment, that the light has come into the world, and men loved the darkness rather than the light; for their works were evil.


For everyone who does evil hates the light, and doesn’t come to the light, lest his works would be exposed.


But he who does the truth comes to the light, that his works may be revealed, that they have been done in God.”
",3
John 19:16-30,"So then he delivered him to them to be crucified. So they took Jesus and led him away.
He went out, bearing his cross, to the place called “The Place of a Skull”, which is called in Hebrew, “Golgotha”,
where they crucified him, and with him two others, on either side one, and Jesus in the middle.
Pilate wrote a title also, and put it on the cross. There was written, “JESUS OF NAZARETH, THE KING OF THE JEWS.”
Therefore many of the Jews read this title, for the place where Jesus was crucified was near the city; and it was written in Hebrew, in Latin, and in Greek.
The chief priests of the Jews therefore said to Pilate, “Don’t write, ‘The King of the Jews,’ but, ‘he said, “I am King of the Jews.”’”
Pilate answered, “What I have written, I have written.”
Then the soldiers, when they had crucified Jesus, took his garments and made four parts, to every soldier a part; and also the coat. Now the coat was without seam, woven from the top throughout.
Then they said to one another, “Let’s not tear it, but cast lots for it to decide whose it will be,” that the Scripture might be fulfilled, which says,
“They parted my garments among them.
For my cloak they cast lots.”
Therefore the soldiers did these things.
But there were standing by the cross of Jesus his mother, and his mother’s sister, Mary the wife of Clopas, and Mary Magdalene.
Therefore when Jesus saw his mother, and the disciple whom he loved standing there, he said to his mother,
“Woman, behold, your son!”

Then he said to the disciple,
“Behold, your mother!” From that hour, the disciple took her to his own home.
After this, Jesus, seeing that all things were now finished, that the Scripture might be fulfilled, said,
“I am thirsty.”
Now a vessel full of vinegar was set there; so they put a sponge full of the vinegar on hyssop, and held it at his mouth.
When Jesus therefore had received the vinegar, he said,
“It is finished.” He bowed his head, and gave up his spirit.
",0
John 20:1-18,"Now on the first day of the week, Mary Magdalene went early, while it was still dark, to the tomb, and saw the stone taken away from the tomb.
Therefore she ran and came to Simon Peter, and to the other disciple whom Jesus loved, and said to them, “They have taken away the Lord out of the tomb, and we don’t know where they have laid him!”
Therefore Peter and the other disciple went out, and they went toward the tomb.
They both ran together. The other disciple outran Peter, and came to the tomb first.
Stooping and looking in, he saw the linen cloths lying, yet he didn’t enter in.
Then Simon Peter came, following him, and entered into the tomb. He saw the linen cloths lying,
and the cloth that had been on his head, not lying with the linen cloths, but rolled up in a place by itself.
So then the other disciple who came first to the tomb also entered in, and he saw and believed.
For as yet they didn’t know the Scripture, that he must rise from the dead.
So the disciples went away again to their own homes.
But Mary was standing outside at the tomb weeping. So, as she wept, she stooped and looked into the tomb,
and she saw two angels in white sitting, one at the head, and one at the feet, where the body of Jesus had lain.
They told her, “Woman, why are you weeping?”
She said to them, “Because they have taken away my Lord, and I don’t know where they have laid him.”
When she had said this, she turned around and saw Jesus standing, and didn’t know that it was Jesus.
Jesus said to her,
“Woman, why are you weeping? Who are you looking for?”
She, supposing him to be the gardener, said to him, “Sir, if you have carried him away, tell me where you have laid him, and I will take him away.”
Jesus said to her,
“Mary.”
She turned and said to him, “Rabboni!” which is to say, “Teacher!”
Jesus said to her,
“Don’t hold me, for I haven’t yet ascended to my Father; but go to my brothers, and tell them, ‘I am ascending to my Father and your Father, to my God and your God.’”
Mary Magdalene came and told the disciples that she had seen the Lord, and that he had said these things to her.
",0
