verse,text
Luke 3:21-22,"Now when all the people were baptized, Jesus also had been baptized, and was praying. The sky was opened,
and the Holy Spirit descended in a bodily form like a dove on him; and a voice came out of the sky, saying “You are my beloved Son. In you I am well pleased.”
"
"Mark 15,40-41","Immediately in the morning the chief priests, with the elders and scribes, and the whole council, held a consultation, and bound Jesus, and carried him away, and delivered him up to Pilate.
Pilate asked him, “Are you the King of the Jews?”
He answered,
“So you say.”
The chief priests accused him of many things.
Pilate again asked him, “Have you no answer? See how many things they testify against you!”
But Jesus made no further answer, so that Pilate marveled.
Now at the feast he used to release to them one prisoner, whom they asked of him.
There was one called Barabbas, bound with his fellow insurgents, men who in the insurrection had committed murder.
The multitude, crying aloud, began to ask him to do as he always did for them.
Pilate answered them, saying, “Do you want me to release to you the King of the Jews?”
For he perceived that for envy the chief priests had delivered him up.
But the chief priests stirred up the multitude, that he should release Barabbas to them instead.
Pilate again asked them, “What then should I do to him whom you call the King of the Jews?”
They cried out again, “Crucify him!”
Pilate said to them, “Why, what evil has he done?”
But they cried out exceedingly, “Crucify him!”
Pilate, wishing to please the multitude, released Barabbas to them, and handed over Jesus, when he had flogged him, to be crucified.
The soldiers led him away within the court, which is the Praetorium; and they called together the whole cohort.
They clothed him with purple, and weaving a crown of thorns, they put it on him.
They began to salute him, “Hail, King of the Jews!”
They struck his head with a reed, and spat on him, and bowing their knees, did homage to him.
When they had mocked him, they took the purple off him, and put his own garments on him. They led him out to crucify him.
They compelled one passing by, coming from the country, Simon of Cyrene, the father of Alexander and Rufus, to go with them, that he might bear his cross.
They brought him to the place called Golgotha, which is, being interpreted, “The place of a skull.”
They offered him wine mixed with myrrh to drink, but he didn’t take it.
Crucifying him, they parted his garments among them, casting lots on them, what each should take.
It was the third hour,
 and they crucified him.
The superscription of his accusation was written over him, “THE KING OF THE JEWS.”
With him they crucified two robbers; one on his right hand, and one on his left.
The Scripture was fulfilled, which says, “He was counted with transgressors.”

Those who passed by blasphemed him, wagging their heads, and saying, “Ha! You who destroy the temple, and build it in three days,
save yourself, and come down from the cross!”
Likewise, also the chief priests mocking among themselves with the scribes said, “He saved others. He can’t save himself.
Let the Christ, the King of Israel, now come down from the cross, that we may see and believe him.”
 Those who were crucified with him also insulted him.
When the sixth hour
 had come, there was darkness over the whole land until the ninth hour.

At the ninth hour Jesus cried with a loud voice, saying,
“Eloi, Eloi, lama sabachthani?” which is, being interpreted,
“My God, my God, why have you forsaken me?”

Some of those who stood by, when they heard it, said, “Behold, he is calling Elijah.”
One ran, and filling a sponge full of vinegar, put it on a reed, and gave it to him to drink, saying, “Let him be. Let’s see whether Elijah comes to take him down.”
Jesus cried out with a loud voice, and gave up the spirit.
The veil of the temple was torn in two from the top to the bottom.
When the centurion, who stood by opposite him, saw that he cried out like this and breathed his last, he said, “Truly this man was the Son of God!”
There were also women watching from afar, among whom were both Mary Magdalene, and Mary the mother of James the less and of Joses, and Salome;
who, when he was in Galilee, followed him, and served him; and many other women who came up with him to Jerusalem.
When evening had now come, because it was the Preparation Day, that is, the day before the Sabbath,
Joseph of Arimathaea, a prominent council member who also himself was looking for God’s Kingdom, came. He boldly went in to Pilate, and asked for Jesus’ body.
Pilate marveled if he were already dead; and summoning the centurion, he asked him whether he had been dead long.
When he found out from the centurion, he granted the body to Joseph.
He bought a linen cloth, and taking him down, wound him in the linen cloth, and laid him in a tomb which had been cut out of a rock. He rolled a stone against the door of the tomb.
Mary Magdalene and Mary, the mother of Joses, saw where he was laid.
There were also women watching from afar, among whom were both Mary Magdalene, and Mary the mother of James the less and of Joses, and Salome;
who, when he was in Galilee, followed him, and served him; and many other women who came up with him to Jerusalem.
"
Matthew 3:13-17,"Then Jesus came from Galilee to the Jordan to John, to be baptized by him.
But John would have hindered him, saying, “I need to be baptized by you, and you come to me?”
But Jesus, answering, said to him,
“Allow it now, for this is the fitting way for us to fulfill all righteousness.” Then he allowed him.
Jesus, when he was baptized, went up directly from the water: and behold, the heavens were opened to him. He saw the Spirit of God descending as a dove, and coming on him.
Behold, a voice out of the heavens said, “This is my beloved Son, with whom I am well pleased.”
"
John 19:25-27,"But there were standing by the cross of Jesus his mother, and his mother’s sister, Mary the wife of Clopas, and Mary Magdalene.
Therefore when Jesus saw his mother, and the disciple whom he loved standing there, he said to his mother,
“Woman, behold, your son!”

Then he said to the disciple,
“Behold, your mother!” From that hour, the disciple took her to his own home.
"
Luke 8:26-39,"They arrived at the country of the Gadarenes, which is opposite Galilee.
When Jesus stepped ashore, a certain man out of the city who had demons for a long time met him. He wore no clothes, and didn’t live in a house, but in the tombs.
When he saw Jesus, he cried out, and fell down before him, and with a loud voice said, “What do I have to do with you, Jesus, you Son of the Most High God? I beg you, don’t torment me!”
For Jesus was commanding the unclean spirit to come out of the man. For the unclean spirit had often seized the man. He was kept under guard, and bound with chains and fetters. Breaking the bonds apart, he was driven by the demon into the desert.
Jesus asked him,
“What is your name?”
He said, “Legion,” for many demons had entered into him.
They begged him that he would not command them to go into the abyss.
Now there was there a herd of many pigs feeding on the mountain, and they begged him that he would allow them to enter into those. He allowed them.
The demons came out of the man, and entered into the pigs, and the herd rushed down the steep bank into the lake, and were drowned.
When those who fed them saw what had happened, they fled, and told it in the city and in the country.
People went out to see what had happened. They came to Jesus, and found the man from whom the demons had gone out, sitting at Jesus’ feet, clothed and in his right mind; and they were afraid.
Those who saw it told them how he who had been possessed by demons was healed.
All the people of the surrounding country of the Gadarenes asked him to depart from them, for they were very much afraid. He entered into the boat, and returned.
But the man from whom the demons had gone out begged him that he might go with him, but Jesus sent him away, saying,

“Return to your house, and declare what great things God has done for you.” He went his way, proclaiming throughout the whole city what great things Jesus had done for him.
"
John 1:29-34,"The next day, he saw Jesus coming to him, and said, “Behold, the Lamb of God, who takes away the sin of the world!
This is he of whom I said, ‘After me comes a man who is preferred before me, for he was before me.’
I didn’t know him, but for this reason I came baptizing in water: that he would be revealed to Israel.”
John testified, saying, “I have seen the Spirit descending like a dove out of heaven, and it remained on him.
I didn’t recognize him, but he who sent me to baptize in water, he said to me, ‘On whomever you will see the Spirit descending, and remaining on him, the same is he who baptizes in the Holy Spirit.’
I have seen, and have testified that this is the Son of God.”
"
Luke 6:27-36,"
“But I tell you who hear: love your enemies, do good to those who hate you,


bless those who curse you, and pray for those who mistreat you.


To him who strikes you on the cheek, offer also the other; and from him who takes away your cloak, don’t withhold your coat also.


Give to everyone who asks you, and don’t ask him who takes away your goods to give them back again.

“As you would like people to do to you, do exactly so to them.


If you love those who love you, what credit is that to you? For even sinners love those who love them.


If you do good to those who do good to you, what credit is that to you? For even sinners do the same.


If you lend to those from whom you hope to receive, what credit is that to you? Even sinners lend to sinners, to receive back as much.


But love your enemies, and do good, and lend, expecting nothing back; and your reward will be great, and you will be children of the Most High; for he is kind toward the unthankful and evil.

“Therefore be merciful,
even as your Father is also merciful.
"
John 20:1-18,"Now on the first day of the week, Mary Magdalene went early, while it was still dark, to the tomb, and saw the stone taken away from the tomb.
Therefore she ran and came to Simon Peter, and to the other disciple whom Jesus loved, and said to them, “They have taken away the Lord out of the tomb, and we don’t know where they have laid him!”
Therefore Peter and the other disciple went out, and they went toward the tomb.
They both ran together. The other disciple outran Peter, and came to the tomb first.
Stooping and looking in, he saw the linen cloths lying, yet he didn’t enter in.
Then Simon Peter came, following him, and entered into the tomb. He saw the linen cloths lying,
and the cloth that had been on his head, not lying with the linen cloths, but rolled up in a place by itself.
So then the other disciple who came first to the tomb also entered in, and he saw and believed.
For as yet they didn’t know the Scripture, that he must rise from the dead.
So the disciples went away again to their own homes.
But Mary was standing outside at the tomb weeping. So, as she wept, she stooped and looked into the tomb,
and she saw two angels in white sitting, one at the head, and one at the feet, where the body of Jesus had lain.
They told her, “Woman, why are you weeping?”
She said to them, “Because they have taken away my Lord, and I don’t know where they have laid him.”
When she had said this, she turned around and saw Jesus standing, and didn’t know that it was Jesus.
Jesus said to her,
“Woman, why are you weeping? Who are you looking for?”
She, supposing him to be the gardener, said to him, “Sir, if you have carried him away, tell me where you have laid him, and I will take him away.”
Jesus said to her,
“Mary.”
She turned and said to him, “Rabboni!” which is to say, “Teacher!”
Jesus said to her,
“Don’t hold me, for I haven’t yet ascended to my Father; but go to my brothers, and tell them, ‘I am ascending to my Father and your Father, to my God and your God.’”
Mary Magdalene came and told the disciples that she had seen the Lord, and that he had said these things to her.
"
Luke 11:1-4,"When he finished praying in a certain place, one of his disciples said to him, “Lord, teach us to pray, just as John also taught his disciples.”
He said to them,
“When you pray, say,
‘Our Father in heaven,
may your name be kept holy.
May your Kingdom come.
May your will be done on earth, as it is in heaven.

Give us day by day our daily bread.

Forgive us our sins,
for we ourselves also forgive everyone who is indebted to us.

Bring us not into temptation,
but deliver us from the evil one.’”
"
John 2:14-21,"He found in the temple those who sold oxen, sheep, and doves, and the changers of money sitting.
He made a whip of cords, and threw all out of the temple, both the sheep and the oxen; and he poured out the changers’ money, and overthrew their tables.
To those who sold the doves, he said,
“Take these things out of here! Don’t make my Father’s house a marketplace!”
His disciples remembered that it was written, “Zeal for your house will eat me up.”
The Jews therefore answered him, “What sign do you show us, seeing that you do these things?”
Jesus answered them,
“Destroy this temple, and in three days I will raise it up.”
The Jews therefore said, “It took forty-six years to build this temple! Will you raise it up in three days?”
But he spoke of the temple of his body.
"
Matthew 13:1-9,"On that day Jesus went out of the house, and sat by the seaside.
Great multitudes gathered to him, so that he entered into a boat, and sat, and all the multitude stood on the beach.
He spoke to them many things in parables, saying,
“Behold, a farmer went out to sow.


As he sowed, some seeds fell by the roadside, and the birds came and devoured them.


Others fell on rocky ground, where they didn’t have much soil, and immediately they sprang up, because they had no depth of earth.


When the sun had risen, they were scorched. Because they had no root, they withered away.


Others fell among thorns. The thorns grew up and choked them.


Others fell on good soil, and yielded fruit: some one hundred times as much, some sixty, and some thirty.


He who has ears to hear, let him hear.”
"
Mark 1:9-11,"In those days, Jesus came from Nazareth of Galilee, and was baptized by John in the Jordan.
Immediately coming up from the water, he saw the heavens parting, and the Spirit descending on him like a dove.
A voice came out of the sky, “You are my beloved Son, in whom I am well pleased.”
"
Mark 1:12-13,"Immediately the Spirit drove him out into the wilderness.
He was there in the wilderness forty days tempted by Satan. He was with the wild animals; and the angels were serving him.
"
Matthew 4:1-11,"Then Jesus was led up by the Spirit into the wilderness to be tempted by the devil.
When he had fasted forty days and forty nights, he was hungry afterward.
The tempter came and said to him, “If you are the Son of God, command that these stones become bread.”
But he answered,
“It is written, ‘Man shall not live by bread alone, but by every word that proceeds out of the mouth of God.’”
Then the devil took him into the holy city. He set him on the pinnacle of the temple,
and said to him, “If you are the Son of God, throw yourself down, for it is written, ‘He will put his angels in charge of you.’ and,
‘On their hands they will bear you up,
so that you don’t dash your foot against a stone.’”
Jesus said to him,
“Again, it is written, ‘You shall not test the Lord, your God.’”
Again, the devil took him to an exceedingly high mountain, and showed him all the kingdoms of the world, and their glory.
He said to him, “I will give you all of these things, if you will fall down and worship me.”
Then Jesus said to him,
“Get behind me,
Satan! For it is written, ‘You shall worship the Lord your God, and you shall serve him only.’”

Then the devil left him, and behold, angels came and served him.
"
Luke 8:11-15,"
Now the parable is this: The seed is the word of God.


Those along the road are those who hear, then the devil comes, and takes away the word from their heart, that they may not believe and be saved.


Those on the rock are they who, when they hear, receive the word with joy; but these have no root, who believe for a while, then fall away in time of temptation.


That which fell among the thorns, these are those who have heard, and as they go on their way they are choked with cares, riches, and pleasures of life, and bring no fruit to maturity.


Those in the good ground, these are those who with an honest and good heart, having heard the word, hold it tightly, and produce fruit with perseverance.
"
Matthew 17:1-8,"After six days, Jesus took with him Peter, James, and John his brother, and brought them up into a high mountain by themselves.
He was transfigured before them. His face shone like the sun, and his garments became as white as the light.
Behold, Moses and Elijah appeared to them talking with him.
Peter answered, and said to Jesus, “Lord, it is good for us to be here. If you want, let’s make three tents here: one for you, one for Moses, and one for Elijah.”
While he was still speaking, behold, a bright cloud overshadowed them. Behold, a voice came out of the cloud, saying, “This is my beloved Son, in whom I am well pleased. Listen to him.”
When the disciples heard it, they fell on their faces, and were very afraid.
Jesus came and touched them and said,
“Get up, and don’t be afraid.”

Lifting up their eyes, they saw no one, except Jesus alone.
"
Mark 5:1-20,"They came to the other side of the sea, into the country of the Gadarenes.
When he had come out of the boat, immediately a man with an unclean spirit met him out of the tombs.
He lived in the tombs. Nobody could bind him any more, not even with chains,
because he had been often bound with fetters and chains, and the chains had been torn apart by him, and the fetters broken in pieces. Nobody had the strength to tame him.
Always, night and day, in the tombs and in the mountains, he was crying out, and cutting himself with stones.
When he saw Jesus from afar, he ran and bowed down to him,
and crying out with a loud voice, he said, “What have I to do with you, Jesus, you Son of the Most High God? I adjure you by God, don’t torment me.”
For he said to him,
“Come out of the man, you unclean spirit!”

He asked him,
“What is your name?”
He said to him, “My name is Legion, for we are many.”
He begged him much that he would not send them away out of the country.
Now on the mountainside there was a great herd of pigs feeding.
All the demons begged him, saying, “Send us into the pigs, that we may enter into them.”
At once Jesus gave them permission. The unclean spirits came out and entered into the pigs. The herd of about two thousand rushed down the steep bank into the sea, and they were drowned in the sea.
Those who fed them fled, and told it in the city and in the country.
The people came to see what it was that had happened.
They came to Jesus, and saw him who had been possessed by demons sitting, clothed, and in his right mind, even him who had the legion; and they were afraid.
Those who saw it declared to them what happened to him who was possessed by demons, and about the pigs.
They began to beg him to depart from their region.
As he was entering into the boat, he who had been possessed by demons begged him that he might be with him.
He didn’t allow him, but said to him,
“Go to your house, to your friends, and tell them what great things the Lord has done for you, and how he had mercy on you.”
He went his way, and began to proclaim in Decapolis how Jesus had done great things for him, and everyone marveled.
"
Mark 11:15-18,"They came to Jerusalem, and Jesus entered into the temple, and began to throw out those who sold and those who bought in the temple, and overthrew the money changers’ tables, and the seats of those who sold the doves.
He would not allow anyone to carry a container through the temple.
He taught, saying to them,
“Isn’t it written, ‘My house will be called a house of prayer for all the nations?’
But you have made it a den of robbers!”
The chief priests and the scribes heard it, and sought how they might destroy him. For they feared him, because all the multitude was astonished at his teaching.
"
Mark 5:21-43,"When Jesus had crossed back over in the boat to the other side, a great multitude was gathered to him; and he was by the sea.
Behold, one of the rulers of the synagogue, Jairus by name, came; and seeing him, he fell at his feet,
and begged him much, saying, “My little daughter is at the point of death. Please come and lay your hands on her, that she may be made healthy, and live.”
He went with him, and a great multitude followed him, and they pressed upon him on all sides.
A certain woman, who had an issue of blood for twelve years,
and had suffered many things by many physicians, and had spent all that she had, and was no better, but rather grew worse,
having heard the things concerning Jesus, came up behind him in the crowd, and touched his clothes.
For she said, “If I just touch his clothes, I will be made well.”
Immediately the flow of her blood was dried up, and she felt in her body that she was healed of her affliction.
Immediately Jesus, perceiving in himself that the power had gone out from him, turned around in the crowd, and asked,
“Who touched my clothes?”
His disciples said to him, “You see the multitude pressing against you, and you say, ‘Who touched me?’”
He looked around to see her who had done this thing.
But the woman, fearing and trembling, knowing what had been done to her, came and fell down before him, and told him all the truth.
He said to her,
“Daughter, your faith has made you well. Go in peace, and be cured of your disease.”
While he was still speaking, people came from the synagogue ruler’s house saying, “Your daughter is dead. Why bother the Teacher any more?”
But Jesus, when he heard the message spoken, immediately said to the ruler of the synagogue,
“Don’t be afraid, only believe.”
He allowed no one to follow him, except Peter, James, and John the brother of James.
He came to the synagogue ruler’s house, and he saw an uproar, weeping, and great wailing.
When he had entered in, he said to them,
“Why do you make an uproar and weep? The child is not dead, but is asleep.”
They ridiculed him. But he, having put them all out, took the father of the child, her mother, and those who were with him, and went in where the child was lying.
Taking the child by the hand, he said to her,
“Talitha cumi!”
 which means, being interpreted,
“Girl, I tell you, get up!”

Immediately the girl rose up and walked, for she was twelve years old. They were amazed with great amazement.
He strictly ordered them that no one should know this, and commanded that something should be given to her to eat.
"
Mark 4:13-20,"He said to them,
“Don’t you understand this parable? How will you understand all of the parables?


The farmer sows the word.


The ones by the road are the ones where the word is sown; and when they have heard, immediately Satan comes, and takes away the word which has been sown in them.


These in the same way are those who are sown on the rocky places, who, when they have heard the word, immediately receive it with joy.


They have no root in themselves, but are short-lived. When oppression or persecution arises because of the word, immediately they stumble.


Others are those who are sown among the thorns. These are those who have heard the word,


and the cares of this age, and the deceitfulness of riches, and the lusts of other things entering in choke the word, and it becomes unfruitful.


Those which were sown on the good ground are those who hear the word, and accept it, and bear fruit, some thirty times, some sixty times, and some one hundred times.”
"
Luke 4:1-13,"Jesus, full of the Holy Spirit, returned from the Jordan, and was led by the Spirit into the wilderness
for forty days, being tempted by the devil. He ate nothing in those days. Afterward, when they were completed, he was hungry.
The devil said to him, “If you are the Son of God, command this stone to become bread.”
Jesus answered him, saying,
“It is written, ‘Man shall not live by bread alone, but by every word of God.’”
The devil, leading him up on a high mountain, showed him all the kingdoms of the world in a moment of time.
The devil said to him, “I will give you all this authority, and their glory, for it has been delivered to me; and I give it to whomever I want.
If you therefore will worship before me, it will all be yours.”
Jesus answered him,
“Get behind me Satan! For it is written, ‘You shall worship the Lord your God, and you shall serve him only.’”
He led him to Jerusalem, and set him on the pinnacle of the temple, and said to him, “If you are the Son of God, cast yourself down from here,
for it is written,
‘He will put his angels in charge of you, to guard you;’
and,
‘On their hands they will bear you up,
lest perhaps you dash your foot against a stone.’”
Jesus answering, said to him,
“It has been said, ‘You shall not tempt the Lord your God.’”
When the devil had completed every temptation, he departed from him until another time.
"
